{
  "name": "ralph-loop",
  "version": "1.0.0",
  "description": "Continuous self-referential AI loops for interactive iterative development, implementing the Ralph Wiggum technique. Run Gemini in a while-true loop with the same prompt until task completion.",
  "author": {
    "name": "Google",
    "email": "support@antigravity.google"
  }
}
